                                                                                       Best trial: 0. Best value: 0.955128:  90%|█████████ | 18/20 [2:04:10<11:27, 343.84s/it]Best trial: 0. Best value: 0.955128:  90%|█████████ | 18/20 [2:04:10<11:27, 343.84s/it]Best trial: 0. Best value: 0.955128:  95%|█████████▌| 19/20 [2:04:10<05:04, 304.94s/it][I 2025-06-20 23:12:53,005] Trial 18 finished with value: 0.9391025641025641 and parameters: {'lr': 0.00963202849897143, 'batch_size': 64, 'optimizer': 'sgd', 'weight_decay': 7.208531661224438e-06, 'milestone1': 32, 'milestone2': 41, 'gamma': 0.13343275298363153, 'patience': 13, 'validation_freq': 8}. Best is trial 0 with value: 0.9551282051282052.

── Trial 19 ──
{
  "lr": 0.0012805510459555818,
  "batch_size": 16,
  "optimizer": "sgd",
  "weight_decay": 0.0034177461039604264,
  "milestones": [
    32,
    41
  ],
  "gamma": 0.18878694542993146,
  "patience": 13,
  "val_freq": 3
}
→ Using 7 GPUs via DataParallel
Epoch  3 | train=0.3373 | val_loss=0.2436 | val_acc=0.9215
  ↳ improved
Epoch  6 | train=0.2945 | val_loss=0.2505 | val_acc=0.9199
  ↳ no‑improve (1/13)
Epoch  9 | train=0.2603 | val_loss=0.1980 | val_acc=0.9311
  ↳ improved
                                                                                       Best trial: 0. Best value: 0.955128:  95%|█████████▌| 19/20 [2:10:24<05:04, 304.94s/it]Best trial: 0. Best value: 0.955128:  95%|█████████▌| 19/20 [2:10:24<05:04, 304.94s/it]Best trial: 0. Best value: 0.955128: 100%|██████████| 20/20 [2:10:24<00:00, 325.67s/it]Best trial: 0. Best value: 0.955128: 100%|██████████| 20/20 [2:10:24<00:00, 391.21s/it]
Epoch 12 | train=0.2143 | val_loss=0.1893 | val_acc=0.9327
  ↳ improved
[I 2025-06-20 23:19:06,990] Trial 19 pruned. 

============================================================
HPO finished » best_trial=0 | best_acc=0.9551
  lr: 0.008244162602397142
  batch_size: 64
  optimizer: sgd
  weight_decay: 0.002712782161696706
  milestone1: 30
  milestone2: 38
  gamma: 0.2740513446648188
  patience: 12
  validation_freq: 6

Retraining with best parameters:
{
  "lr": 0.008244162602397142,
  "batch_size": 64,
  "optimizer": "sgd",
  "weight_decay": 0.002712782161696706,
  "milestone1": 30,
  "milestone2": 38,
  "gamma": 0.2740513446648188,
  "patience": 12,
  "validation_freq": 6
}
Using 7 GPUs via DataParallel

Starting full training (max 100 epochs)…
------------------------------------------------------------
Epoch   1 | train_loss=0.3729 | val_loss=0.6102 | val_acc=0.8397 | lr=0.008244
          → New best model saved (0.8397)
Epoch   2 | train_loss=0.2728 | val_loss=0.2162 | val_acc=0.9439 | lr=0.008244
          → New best model saved (0.9439)
Epoch   3 | train_loss=0.2606 | val_loss=0.3592 | val_acc=0.8974 | lr=0.008244
Epoch   4 | train_loss=0.2382 | val_loss=0.1241 | val_acc=0.9535 | lr=0.008244
          → New best model saved (0.9535)
Epoch   5 | train_loss=0.2116 | val_loss=0.3335 | val_acc=0.9022 | lr=0.008244
Epoch   6 | train_loss=0.1877 | val_loss=0.1428 | val_acc=0.9535 | lr=0.008244
Epoch   7 | train_loss=0.1858 | val_loss=0.3272 | val_acc=0.8862 | lr=0.008244
Epoch   8 | train_loss=0.1638 | val_loss=0.4270 | val_acc=0.8686 | lr=0.008244
Epoch   9 | train_loss=0.1532 | val_loss=0.1849 | val_acc=0.9407 | lr=0.008244
Epoch  10 | train_loss=0.1586 | val_loss=0.1730 | val_acc=0.9471 | lr=0.008244
Epoch  11 | train_loss=0.1611 | val_loss=0.5145 | val_acc=0.8205 | lr=0.008244
Epoch  12 | train_loss=0.1444 | val_loss=0.2756 | val_acc=0.8990 | lr=0.008244
Epoch  13 | train_loss=0.1675 | val_loss=0.1680 | val_acc=0.9359 | lr=0.008244
Epoch  14 | train_loss=0.1506 | val_loss=0.2278 | val_acc=0.9054 | lr=0.008244
Epoch  15 | train_loss=0.1544 | val_loss=0.1865 | val_acc=0.9423 | lr=0.008244
Epoch  16 | train_loss=0.1512 | val_loss=0.1223 | val_acc=0.9599 | lr=0.008244
          → New best model saved (0.9599)
Epoch  17 | train_loss=0.1402 | val_loss=0.1991 | val_acc=0.9455 | lr=0.008244
Epoch  18 | train_loss=0.1304 | val_loss=0.2894 | val_acc=0.9247 | lr=0.008244
Epoch  19 | train_loss=0.1400 | val_loss=0.1478 | val_acc=0.9423 | lr=0.008244
Epoch  20 | train_loss=0.1437 | val_loss=0.2818 | val_acc=0.9183 | lr=0.008244
Epoch  21 | train_loss=0.1515 | val_loss=0.1230 | val_acc=0.9455 | lr=0.008244
Epoch  22 | train_loss=0.1290 | val_loss=0.2532 | val_acc=0.9279 | lr=0.008244
Epoch  23 | train_loss=0.1272 | val_loss=0.1955 | val_acc=0.9343 | lr=0.008244
Epoch  24 | train_loss=0.1158 | val_loss=0.1694 | val_acc=0.9311 | lr=0.008244
Epoch  25 | train_loss=0.1163 | val_loss=0.1587 | val_acc=0.9423 | lr=0.008244
Epoch  26 | train_loss=0.1250 | val_loss=0.3620 | val_acc=0.8766 | lr=0.008244
Epoch  27 | train_loss=0.1394 | val_loss=0.2555 | val_acc=0.9135 | lr=0.008244
Epoch  28 | train_loss=0.1314 | val_loss=0.2808 | val_acc=0.9119 | lr=0.008244
Epoch  29 | train_loss=0.1195 | val_loss=0.1906 | val_acc=0.9343 | lr=0.008244
Epoch  30 | train_loss=0.1094 | val_loss=0.1475 | val_acc=0.9423 | lr=0.002259
Epoch  31 | train_loss=0.1087 | val_loss=0.2290 | val_acc=0.9263 | lr=0.002259
Epoch  32 | train_loss=0.0885 | val_loss=0.1476 | val_acc=0.9519 | lr=0.002259
Epoch  33 | train_loss=0.0940 | val_loss=0.2011 | val_acc=0.9311 | lr=0.002259
Epoch  34 | train_loss=0.0782 | val_loss=0.2062 | val_acc=0.9343 | lr=0.002259
Epoch  35 | train_loss=0.0845 | val_loss=0.1894 | val_acc=0.9343 | lr=0.002259
Epoch  36 | train_loss=0.0843 | val_loss=0.3145 | val_acc=0.9103 | lr=0.002259
Epoch  37 | train_loss=0.0905 | val_loss=0.2272 | val_acc=0.9295 | lr=0.002259
Epoch  38 | train_loss=0.0764 | val_loss=0.2843 | val_acc=0.9038 | lr=0.000619
Epoch  39 | train_loss=0.0796 | val_loss=0.2256 | val_acc=0.9215 | lr=0.000619
Epoch  40 | train_loss=0.0709 | val_loss=0.2625 | val_acc=0.9167 | lr=0.000619
Epoch  41 | train_loss=0.0650 | val_loss=0.2032 | val_acc=0.9295 | lr=0.000619
Epoch  42 | train_loss=0.0627 | val_loss=0.2420 | val_acc=0.9231 | lr=0.000619
Epoch  43 | train_loss=0.0688 | val_loss=0.2489 | val_acc=0.9215 | lr=0.000619
Epoch  44 | train_loss=0.0617 | val_loss=0.1683 | val_acc=0.9391 | lr=0.000619
Epoch  45 | train_loss=0.0566 | val_loss=0.2210 | val_acc=0.9295 | lr=0.000619
Epoch  46 | train_loss=0.0603 | val_loss=0.1558 | val_acc=0.9423 | lr=0.000619
Epoch  47 | train_loss=0.0611 | val_loss=0.1735 | val_acc=0.9343 | lr=0.000619
Epoch  48 | train_loss=0.0616 | val_loss=0.2672 | val_acc=0.9119 | lr=0.000619
Epoch  49 | train_loss=0.0538 | val_loss=0.2500 | val_acc=0.9167 | lr=0.000619
Epoch  50 | train_loss=0.0647 | val_loss=0.1850 | val_acc=0.9343 | lr=0.000619
Epoch  51 | train_loss=0.0625 | val_loss=0.2161 | val_acc=0.9311 | lr=0.000619
Epoch  52 | train_loss=0.0582 | val_loss=0.2667 | val_acc=0.9135 | lr=0.000619
Epoch  53 | train_loss=0.0561 | val_loss=0.2586 | val_acc=0.9199 | lr=0.000619
Epoch  54 | train_loss=0.0578 | val_loss=0.2422 | val_acc=0.9311 | lr=0.000619
Epoch  55 | train_loss=0.0512 | val_loss=0.2779 | val_acc=0.9119 | lr=0.000619
Epoch  56 | train_loss=0.0661 | val_loss=0.2673 | val_acc=0.9215 | lr=0.000619
Epoch  57 | train_loss=0.0557 | val_loss=0.3376 | val_acc=0.9006 | lr=0.000619
Epoch  58 | train_loss=0.0571 | val_loss=0.2391 | val_acc=0.9279 | lr=0.000619
Epoch  59 | train_loss=0.0556 | val_loss=0.1734 | val_acc=0.9375 | lr=0.000619
Epoch  60 | train_loss=0.0552 | val_loss=0.1893 | val_acc=0.9327 | lr=0.000619
Epoch  61 | train_loss=0.0570 | val_loss=0.2057 | val_acc=0.9295 | lr=0.000619
Epoch  62 | train_loss=0.0528 | val_loss=0.2525 | val_acc=0.9215 | lr=0.000619
Epoch  63 | train_loss=0.0527 | val_loss=0.2810 | val_acc=0.9167 | lr=0.000619
Epoch  64 | train_loss=0.0612 | val_loss=0.2034 | val_acc=0.9359 | lr=0.000619
Epoch  65 | train_loss=0.0614 | val_loss=0.2076 | val_acc=0.9263 | lr=0.000619
Epoch  66 | train_loss=0.0496 | val_loss=0.3216 | val_acc=0.9135 | lr=0.000619
Epoch  67 | train_loss=0.0552 | val_loss=0.2359 | val_acc=0.9215 | lr=0.000619
Epoch  68 | train_loss=0.0550 | val_loss=0.2219 | val_acc=0.9279 | lr=0.000619
Epoch  69 | train_loss=0.0521 | val_loss=0.1903 | val_acc=0.9423 | lr=0.000619
Epoch  70 | train_loss=0.0515 | val_loss=0.1741 | val_acc=0.9407 | lr=0.000619
Epoch  71 | train_loss=0.0502 | val_loss=0.1813 | val_acc=0.9391 | lr=0.000619
Epoch  72 | train_loss=0.0521 | val_loss=0.2029 | val_acc=0.9295 | lr=0.000619
Epoch  73 | train_loss=0.0468 | val_loss=0.1597 | val_acc=0.9487 | lr=0.000619
Epoch  74 | train_loss=0.0489 | val_loss=0.1917 | val_acc=0.9295 | lr=0.000619
Epoch  75 | train_loss=0.0585 | val_loss=0.1984 | val_acc=0.9391 | lr=0.000619
Epoch  76 | train_loss=0.0574 | val_loss=0.2755 | val_acc=0.9119 | lr=0.000619
Epoch  77 | train_loss=0.0516 | val_loss=0.1797 | val_acc=0.9407 | lr=0.000619
Epoch  78 | train_loss=0.0576 | val_loss=0.1719 | val_acc=0.9407 | lr=0.000619
Epoch  79 | train_loss=0.0479 | val_loss=0.2538 | val_acc=0.9183 | lr=0.000619
Epoch  80 | train_loss=0.0490 | val_loss=0.2498 | val_acc=0.9135 | lr=0.000619
Epoch  81 | train_loss=0.0470 | val_loss=0.2923 | val_acc=0.9135 | lr=0.000619
Epoch  82 | train_loss=0.0489 | val_loss=0.3682 | val_acc=0.8942 | lr=0.000619
Epoch  83 | train_loss=0.0562 | val_loss=0.2494 | val_acc=0.9151 | lr=0.000619
Epoch  84 | train_loss=0.0507 | val_loss=0.1490 | val_acc=0.9535 | lr=0.000619
Epoch  85 | train_loss=0.0429 | val_loss=0.2513 | val_acc=0.9247 | lr=0.000619
Epoch  86 | train_loss=0.0550 | val_loss=0.2024 | val_acc=0.9423 | lr=0.000619
Epoch  87 | train_loss=0.0527 | val_loss=0.2040 | val_acc=0.9343 | lr=0.000619
Epoch  88 | train_loss=0.0422 | val_loss=0.2225 | val_acc=0.9327 | lr=0.000619

Early‑stopping after 72 no‑improve epochs → best_acc=0.9599
------------------------------------------------------------
Training finished • best_val_acc=0.9599
Final accuracy=0.9599 | final loss=0.1223
Training curves saved as training_curves.png
